{
    "from_mnemonic": {
        "msg_key_creation": "Se creează cheile:\t\t"
    },
    "export_keystores": {
        "msg_keystore_creation": "Se creează depozitele de chei:\t"
    },
    "export_deposit_data_json": {
        "msg_depositdata_creation": "Se creează datele de depozit:\t"
    },
    "verify_keystores": {
        "msg_keystore_verification": "Se verifică depozitele de chei:\t"
    }
}