{
    "from_mnemonic": {
        "msg_key_creation": "Membuat kunci Anda:\t\t"
    },
    "export_keystores": {
        "msg_keystore_creation": "Membuat keystore Anda:\t"
    },
    "export_deposit_data_json": {
        "msg_depositdata_creation": "Membuat depositdata Anda:\t"
    },
    "verify_keystores": {
        "msg_keystore_verification": "Memverifikasi keystore Anda:\t"
    }
}