{
    "from_mnemonic": {
        "msg_key_creation": "Criação das suas chaves:\t\t"
    },
    "export_keystores": {
        "msg_keystore_creation": "Criação dos seus keystores:\t"
    },
    "export_deposit_data_json": {
        "msg_depositdata_creation": "Criação dos seus dados de depósito:\t"
    },
    "verify_keystores": {
        "msg_keystore_verification": "Verificação dos seus keystores:\t"
    }
}