{
    "from_mnemonic": {
        "msg_key_creation": "키 생성 중:\t\t"
    },
    "export_keystores": {
        "msg_keystore_creation": "키스토어 생성 중:\t"
    },
    "export_deposit_data_json": {
        "msg_depositdata_creation": "예치금 데이터 생성 중:\t"
    },
    "verify_keystores": {
        "msg_keystore_verification": "키스토어 검증 중:\t"
    }
}