{
    "from_mnemonic": {
        "msg_key_creation": "Creazione delle tue chiavi:\t\t"
    },
    "export_keystores": {
        "msg_keystore_creation": "Creazione dei tuoi archivi chiavi:\t"
    },
    "export_deposit_data_json": {
        "msg_depositdata_creation": "Creazione dei tuoi dati di deposito:\t"
    },
    "verify_keystores": {
        "msg_keystore_verification": "Verifica dei tuoi archivi chiavi:\t"
    }
}