{
    "from_mnemonic": {
        "msg_key_creation": "キーを作成しています:\t\t"
    },
    "export_keystores": {
        "msg_keystore_creation": "キーストアを作成しています:\t"
    },
    "export_deposit_data_json": {
        "msg_depositdata_creation": "デポジットデータを作成しています:\t"
    },
    "verify_keystores": {
        "msg_keystore_verification": "キーストアを確認しています:\t"
    }
}