{
    "from_mnemonic": {
        "msg_key_creation": "Δημιουργώντας τα κλειδιά σας:\t\t"
    },
    "export_keystores": {
        "msg_keystore_creation": "Δημιουργώντας τους χώρους αποθήκευσης των κλειδιών σας:\t"
    },
    "export_deposit_data_json": {
        "msg_depositdata_creation": "Δημιουργώντας τα δεδομένα κατάθεσής σας:\t"
    },
    "verify_keystores": {
        "msg_keystore_verification": "Δημιουργώντας τους χώρους αποθήκευσης των κλειδιών σας:\t"
    }
}