{
    "from_mnemonic": {
        "msg_key_creation": "Création de vos clés :\t\t"
    },
    "export_keystores": {
        "msg_keystore_creation": "Création de vos keystores :\t"
    },
    "export_deposit_data_json": {
        "msg_depositdata_creation": "Création de vos données de dépôt :\t"
    },
    "verify_keystores": {
        "msg_keystore_verification": "Vérification de vos keystores :\t"
    }
}